{
  "$schema": "http://json-schema.org/draft-07/schema#",
  "type": "object",
  "required": [
    "port",
    "assetTrailInstanceID",
    "protocol",
    "apiGateway",
    "eventStreams",
    "ipfs",
    "app2app",
    "docExchange",
    "appCredentials"
  ],
  "properties": {
    "port": {
      "type": "integer"
    },
    "assetTrailInstanceID": {
      "type": "string"
    },
    "protocol": {
      "type": "string",
      "enum": ["ethereum", "corda"]
    },
    "apiGateway": {
      "type": "object",
      "required": [
        "apiEndpoint"
      ],
      "properties": {
        "apiEndpoint": {
          "type": "string"
        }, 
        "auth": {
          "type": "object",
          "required": [
            "user",
            "password"
          ],
          "properties": {
            "user": {
              "type": "string"
            },
            "password": {
              "type": "string"
            }
          }
        }
      }
    },
    "eventStreams": {
      "type": "object",
      "required": [
        "wsEndpoint",
        "topic"
      ],
      "properties": {
        "wsEndpoint": {
          "type": "string"
        },
        "topic": {
          "type": "string"
        },
        "skipSetup": {
          "type": "boolean"
        },
        "auth": {
          "type": "object",
          "required": [
            "user",
            "password"
          ],
          "properties": {
            "user": {
              "type": "string"
            },
            "password": {
              "type": "string"
            }
          }
        }
      }
    },
    "ipfs": {
      "type": "object",
      "required": [
        "apiEndpoint"
      ],
      "properties": {
        "apiEndpoint": {
          "type": "string"
        },
        "gatewayEndpoint": {
          "type": "string"
        }
      }
    },
    "app2app": {
      "type": "object",
      "required": [
        "socketIOEndpoint",
        "destinations"
      ],
      "properties": {
        "socketIOEndpoint": {
          "type": "string"
        },
        "destinations": {
          "type": "object",
          "required": [
            "kat",
            "client"
          ],
          "properties": {
            "kat": {
              "type": "string"
            },
            "client": {
              "type": "string"
            }
          }
        }
      }
    },
    "docExchange": {
      "type": "object",
      "required": [
        "apiEndpoint",
        "socketIOEndpoint",
        "destination"
      ],
      "properties": {
        "apiEndpoint": {
          "type": "string"
        },
        "socketIOEndpoint": {
          "type": "string"
        },
        "destination": {
          "type": "string"
        }
      }
    },
    "appCredentials": {
      "type": "object",
      "required": [
        "user",
        "password"
      ],
      "properties": {
        "user": {
          "type": "string"
        },
        "password": {
          "type": "string"
        }
      }
    },
    "mongodb": {
      "type": "object",
      "required": [
        "connectionUrl",
        "databaseName"
      ],
      "connectionUrl": {
        "type": "string"
      },
      "databaseName": {
        "type": "string"
      }
    }
  }
}