{
  "$schema": "../../../src/schemas/config.json",
  "port": 4001,
  "assetTrailInstanceID": "asset-trail-org-a",
  "protocol": "ethereum",
  "apiGateway": {
    "apiEndpoint": "https://zzkuwhhizm-zzhh7vdg4w-connect.dev2.photic.io/instances/0x2af2b71292fcb2af2423b1820cfb0d6e2be2c4a4"
  },
  "eventStreams": {
    "wsEndpoint": "wss://zzkuwhhizm-zzhh7vdg4w-connect.dev2-ws.photic.io/ws",
    "topic": "synaptic"
  },
  "ipfs": {
    "apiEndpoint": "https://zzkuwhhizm-zzh1ibg3o0-ipfs.dev2.photic.io"
  },
  "app2app": {
    "socketIOEndpoint": "wss://zzkuwhhizm-zzigaja3ua.dev2-ws.photic.io/api/v1",
    "destinations": {
      "kat": "kld://app2app/z/dev2/m/zzxknul1nt/e/zzkuwhhizm/s/zzigaja3ua/d/a",
      "client": "kld://app2app/z/dev2/m/zzxknul1nt/e/zzkuwhhizm/s/zzigaja3ua/d/external"
    }
  },
  "docExchange": {
    "apiEndpoint": "https://zzkuwhhizm-zzpp1ys1l8-documentstore.dev2.photic.io/api/v1",
    "socketIOEndpoint": "wss://zzkuwhhizm-zzpp1ys1l8.dev2-ws.photic.io/api/v1",
    "destination": "kld://documentstore/z/dev2/m/zzxknul1nt/e/zzkuwhhizm/s/zzpp1ys1l8/d/a"
  },
  "appCredentials": {
    "user": "zzbvccppd3",
    "password": "_WOhsqQ6ee8pW39Surq9XkZvP4Al-hjDNoFaKUQQF20"
  },
  "mongodb": {
    "connectionUrl": "mongodb://localhost:27017",
    "databaseName": "synaptic-sr-org-a"
  }
}
