{
  "$schema": "../../../src/schemas/config.json",
  "port": 4001,
  "assetTrailInstanceID": "asset-trail-org-a",
  "protocol": "ethereum",
  "apiGateway": {
    "apiEndpoint": "https://zzdk0au9rl-zznm62sm1o-connect.dev2.photic.io/instances/0xc4ed58b23059e5b2f867b6040b46dcea04396c8b"
  },
  "eventStreams": {
    "wsEndpoint": "wss://zzdk0au9rl-zznm62sm1o-connect.dev2-ws.photic.io/ws",
    "topic": "A"
  },
  "ipfs": {
    "apiEndpoint": "https://zzdk0au9rl-zzrgeqp403-ipfs.dev2.photic.io"
  },
  "app2app": {
    "socketIOEndpoint": "wss://zzdk0au9rl-zzspcgumw6.dev2-ws.photic.io/api/v1",
    "destinations": {
      "kat": "kld://app2app/z/dev2/m/zzdza6cuf9/e/zzdk0au9rl/s/zzspcgumw6/d/kat",
      "client": "kld://app2app/z/dev2/m/zzdza6cuf9/e/zzdk0au9rl/s/zzspcgumw6/d/client"
    }
  },
  "docExchange": {
    "apiEndpoint": "https://zzdk0au9rl-zzu2yrgdqw-documentstore.dev2.photic.io/api/v1",
    "socketIOEndpoint": "wss://zzdk0au9rl-zzu2yrgdqw.dev2-ws.photic.io/api/v1",
    "destination": "kld://documentstore/z/dev2/m/zzdza6cuf9/e/zzdk0au9rl/s/zzu2yrgdqw/d/a"
  },
  "appCredentials": {
    "user": "zzzpyzyey1",
    "password": "RVSTBdP1N9_XVPWzNbKJmTpgfM6dtKECwEdcfk3Kctw"
  },
  "mongodb": {
    "connectionUrl": "mongodb://localhost:27017",
    "databaseName": "synaptic-mr-org-a"
 }
}

