{
    "$schema": "../src/schemas/config.json",
    "port": 3001,
    "protocol": "corda",
    "assetTrailInstanceID": "service-id",
    "apiGateway": {
      "apiEndpoint": "https://apigateway.kaleido.io",
      "auth": {
        "user": "testuser",
        "password": "testpassword"
      }
    },
    "eventStreams": {
      "wsEndpoint": "ws://eventstreams.kaleido.io",
      "topic": "dev",
      "auth": {
        "user": "testuser",
        "password": "testpassword"
      }
    },
    "ipfs": {
      "apiEndpoint": "https://ipfs.kaleido.io"
    },
    "app2app": {
      "socketIOEndpoint": "wss://app2app.ws.kaleido.io",
      "destinations": {
        "kat": "kld://app2app/internal",
        "client": "kld://app2app/external"
      }
    },
    "docExchange": {
      "apiEndpoint": "https://docexchange.kaleido.io",
      "socketIOEndpoint": "http://docexchange.ws.kaleido.io",
      "destination": "kld://docstore/dest"
    },
    "appCredentials": {
      "user": "testuser",
      "password": "testpassword"
    }
  }