{
  "$schema": "../../../src/schemas/config.json",
  "port": 4002,
  "assetTrailInstanceID": "asset-trail-org-b",
  "protocol": "ethereum",
  "apiGateway": {
    "apiEndpoint": "https://zzkuwhhizm-zzyi4f2hqt-connect.dev2.photic.io/instances/0x2af2b71292fcb2af2423b1820cfb0d6e2be2c4a4"
  },
  "eventStreams": {
    "wsEndpoint": "wss://zzkuwhhizm-zzyi4f2hqt-connect.dev2-ws.photic.io/ws",
    "topic": "synaptic"
  },
  "ipfs": {
    "apiEndpoint": "https://zzkuwhhizm-zzvosyrz5t-ipfs.dev2.photic.io"
  },
  "app2app": {
    "socketIOEndpoint": "wss://zzkuwhhizm-zzcpoj78bh.dev2-ws.photic.io/api/v1",
    "destinations": {
      "kat": "kld://app2app/z/dev2/m/zzt1fril6n/e/zzkuwhhizm/s/zzcpoj78bh/d/b",
      "client": "kld://app2app/z/dev2/m/zzt1fril6n/e/zzkuwhhizm/s/zzcpoj78bh/d/external"
    }
  },
  "docExchange": {
    "apiEndpoint": "https://zzkuwhhizm-zzwt65yyp0-documentstore.dev2.photic.io/api/v1",
    "socketIOEndpoint": "wss://zzkuwhhizm-zzwt65yyp0.dev2-ws.photic.io/api/v1",
    "destination": "kld://documentstore/z/dev2/m/zzt1fril6n/e/zzkuwhhizm/s/zzwt65yyp0/d/b"
  },
  "appCredentials": {
    "user": "zzwfeybeli",
    "password": "PiinAvy8PkwP3bBbXw0TrX_fzvBw4KTYtTQzS1QE4zs"
  },
  "mongodb": {
    "connectionUrl": "mongodb://localhost:27017",
    "databaseName": "synaptic-sr-org-b"
  }
}